{
  "$schema": "http://json-schema.org/draft-07/schema#",
  "type": "object",
  "properties": {
    "schemaVersion": {
      "type": "string",
      "const": "1.0"
    },
    "stableKey": {
      "type": "string",
      "minLength": 1
    },
    "goal": {
      "type": "string",
      "minLength": 1
    },
    "inScope": {
      "type": "array",
      "items": {
        "type": "string"
      }
    },
    "outOfScope": {
      "type": "array",
      "items": {
        "type": "string"
      }
    },
    "modules": {
      "type": "array",
      "items": {
        "type": "object",
        "properties": {
          "id": {
            "type": "string",
            "minLength": 1
          },
          "title": {
            "type": "string",
            "minLength": 1
          },
          "description": {
            "type": "string"
          }
        },
        "required": [
          "id",
          "title",
          "description"
        ],
        "additionalProperties": false
      }
    },
    "moduleRelations": {
      "type": "array",
      "items": {
        "type": "object",
        "properties": {
          "id": {
            "type": "string",
            "minLength": 1
          },
          "sourceModuleRef": {
            "type": "string",
            "minLength": 1
          },
          "targetModuleRef": {
            "type": "string",
            "minLength": 1
          },
          "relationType": {
            "type": "string",
            "minLength": 1
          },
          "description": {
            "type": "string"
          },
          "evidenceRefs": {
            "type": "array",
            "items": {
              "type": "string"
            }
          }
        },
        "required": [
          "id",
          "sourceModuleRef",
          "targetModuleRef",
          "relationType",
          "description",
          "evidenceRefs"
        ],
        "additionalProperties": false
      }
    },
    "rules": {
      "type": "array",
      "items": {
        "type": "object",
        "properties": {
          "id": {
            "type": "string",
            "minLength": 1
          },
          "description": {
            "type": "string",
            "minLength": 1
          },
          "evidenceRefs": {
            "type": "array",
            "items": {
              "type": "string"
            }
          }
        },
        "required": [
          "id",
          "description",
          "evidenceRefs"
        ],
        "additionalProperties": false
      }
    },
    "inferences": {
      "type": "array",
      "items": {
        "type": "object",
        "properties": {
          "id": {
            "type": "string",
            "minLength": 1
          },
          "description": {
            "type": "string",
            "minLength": 1
          },
          "basis": {
            "type": "string"
          },
          "evidenceRefs": {
            "type": "array",
            "items": {
              "type": "string"
            }
          },
          "decision": {
            "type": "string",
            "enum": [
              "PENDING",
              "ACCEPTED",
              "REJECTED"
            ]
          }
        },
        "required": [
          "id",
          "description",
          "basis",
          "evidenceRefs",
          "decision"
        ],
        "additionalProperties": false
      }
    },
    "questions": {
      "type": "array",
      "items": {
        "type": "object",
        "properties": {
          "id": {
            "type": "string",
            "minLength": 1
          },
          "question": {
            "type": "string",
            "minLength": 1
          },
          "blocking": {
            "type": "boolean"
          },
          "status": {
            "type": "string",
            "enum": [
              "PENDING",
              "ANSWERED",
              "ASSUMPTION_ACCEPTED",
              "DEFERRED",
              "OUT_OF_SCOPE"
            ]
          },
          "answer": {
            "type": "string"
          },
          "decisionReason": {
            "type": "string"
          },
          "scope": {
            "type": "string",
            "enum": [
              "IN_SCOPE",
              "OUT_OF_SCOPE"
            ]
          }
        },
        "required": [
          "id",
          "question",
          "blocking",
          "status",
          "answer",
          "decisionReason",
          "scope"
        ],
        "additionalProperties": false
      }
    },
    "risks": {
      "type": "array",
      "items": {
        "type": "object",
        "properties": {
          "id": {
            "type": "string",
            "minLength": 1
          },
          "title": {
            "type": "string",
            "minLength": 1
          },
          "description": {
            "type": "string",
            "minLength": 1
          },
          "level": {
            "type": "string",
            "enum": [
              "HIGH",
              "MEDIUM",
              "LOW"
            ]
          },
          "testSignals": {
            "type": "array",
            "items": {
              "type": "string"
            }
          },
          "evidenceRefs": {
            "type": "array",
            "items": {
              "type": "string"
            }
          }
        },
        "required": [
          "id",
          "title",
          "description",
          "level",
          "testSignals",
          "evidenceRefs"
        ],
        "additionalProperties": false
      }
    },
    "evidence": {
      "type": "array",
      "items": {
        "type": "object",
        "properties": {
          "id": {
            "type": "string",
            "minLength": 1
          },
          "sourceType": {
            "type": "string",
            "enum": [
              "REQUIREMENT",
              "ATTACHMENT",
              "HUMAN_DECISION"
            ]
          },
          "sourceRef": {
            "type": "string",
            "minLength": 1
          },
          "quote": {
            "type": "string"
          }
        },
        "required": [
          "id",
          "sourceType",
          "sourceRef",
          "quote"
        ],
        "additionalProperties": false
      }
    }
  },
  "required": [
    "schemaVersion",
    "stableKey",
    "goal",
    "inScope",
    "outOfScope",
    "modules",
    "moduleRelations",
    "rules",
    "inferences",
    "questions",
    "risks",
    "evidence"
  ],
  "additionalProperties": false
}
